{
  "schema_version": "v1.0",
  "benchmark_id": "invisible-tea-party",
  "scenario_id": "tea_004_constraint_paradox",
  "lineage_id": "56f75fa0-8c6d-4cf3-a5e7-ed2b400f4f66",
  "rule_profile_version": "v1_provisional",
  "created_at": "2026-04-07T18:41:31.784Z",
  "arbiter_provider": "gemini",
  "arbiter_model_id": "gemini-3.1-pro-preview",
  "capability_mode": "external_only",
  "core_final_score": 0.49999999999999994,
  "artifact_files": [
    {
      "artifact_name": "pass1_reasoning_state",
      "filename": "pass1.reasoning_state.json",
      "sha256": "dbe44b261e196800701777421e2110443952bab39c59b141723285c574bd5f62"
    },
    {
      "artifact_name": "pass2_reasoning_state",
      "filename": "pass2.reasoning_state.json",
      "sha256": "a575f138baeb18c3d79a98833160c2bdaa7928c3509a9325a6ecf6b4be6692d8"
    },
    {
      "artifact_name": "pass3_reasoning_state",
      "filename": "pass3.reasoning_state.json",
      "sha256": "a7485343de078b2e648617dfd77139d7ee5afcc4f8439fdd52dda335aa0cbe08"
    },
    {
      "artifact_name": "deterministic_verification",
      "filename": "deterministic_verification.json",
      "sha256": "c00ef12f23a94df99390ae254a84b01f0ebfc9d5c6370f7f4784894ec8ab49a0"
    },
    {
      "artifact_name": "arbiter_verification",
      "filename": "arbiter_verification.json",
      "sha256": "501caf0927e2caf5e30f54cf1b13c025416268d07ad0ebe1f8e42b12ff55c8f1"
    },
    {
      "artifact_name": "final_verification",
      "filename": "final_verification.json",
      "sha256": "4520fee346e7f9a9cfc1cac5c8d419da06e44ef6891eed9cfa1f37870505e2fc"
    }
  ],
  "bundle_hash": "26422ed3128e4863c162fc669c9d739c3a089bde4292f78b90c694dced0ec61a"
}
