{
  "schema_version": "v1.0",
  "benchmark_id": "invisible-tea-party",
  "scenario_id": "tea_005_recursive_role",
  "lineage_id": "f9a6e42c-67c1-4985-9e1a-d876afdd1625",
  "rule_profile_version": "v1_provisional",
  "created_at": "2026-04-07T18:43:34.566Z",
  "arbiter_provider": "gemini",
  "arbiter_model_id": "gemini-3.1-pro-preview",
  "capability_mode": "external_only",
  "core_final_score": 0.7946666666666666,
  "artifact_files": [
    {
      "artifact_name": "pass1_reasoning_state",
      "filename": "pass1.reasoning_state.json",
      "sha256": "f6839974f5f918cfc33a65a879dda9e252e09c818e55e156536cbee9350a2095"
    },
    {
      "artifact_name": "pass2_reasoning_state",
      "filename": "pass2.reasoning_state.json",
      "sha256": "17d3631902adc9e83b6b815afc7aaa6231bc025d44c90fbf7a3088d367bc5833"
    },
    {
      "artifact_name": "pass3_reasoning_state",
      "filename": "pass3.reasoning_state.json",
      "sha256": "181f96e13c7d4c5ce0fabd0b5c482172b85d98eb4101d22a2c89535c76d887b0"
    },
    {
      "artifact_name": "deterministic_verification",
      "filename": "deterministic_verification.json",
      "sha256": "abc39e64f5d8312c922ad3fd594d2c463f629eea4b9c0d70498c93d6f8b7ecd8"
    },
    {
      "artifact_name": "arbiter_verification",
      "filename": "arbiter_verification.json",
      "sha256": "2b286f054342ecc9a6345bae7e8cfac155ada0fc49d851507f9e6b17c704e1c5"
    },
    {
      "artifact_name": "final_verification",
      "filename": "final_verification.json",
      "sha256": "470c73d9af1045a0f501db789dcd5f606c7bccf6a00829588bb85044d25fd44a"
    }
  ],
  "bundle_hash": "55ef15df39e3a3c6cf2c3c4cc108e2ff698b70b860c6a28e84208c192777a6b6"
}
