{
  "schema_version": "v1.0",
  "benchmark_id": "invisible-tea-party",
  "scenario_id": "tea_004_constraint_paradox",
  "lineage_id": "249e612c-f94b-43e1-8300-8387bb6a99be",
  "rule_profile_version": "v1_provisional",
  "created_at": "2026-04-07T16:12:25.363Z",
  "arbiter_provider": "anthropic",
  "arbiter_model_id": "haiku",
  "capability_mode": "external_only",
  "core_final_score": 0.6191619047619047,
  "artifact_files": [
    {
      "artifact_name": "pass1_reasoning_state",
      "filename": "pass1.reasoning_state.json",
      "sha256": "434d5fdaef8717dddeb6982fcd99ee4de9da2cea731e3be7201eac176e3ea067"
    },
    {
      "artifact_name": "pass2_reasoning_state",
      "filename": "pass2.reasoning_state.json",
      "sha256": "c8c8bf768988b8d92c152e731205ead1ef6d2a4f4a1a75248202b23848c943ac"
    },
    {
      "artifact_name": "pass3_reasoning_state",
      "filename": "pass3.reasoning_state.json",
      "sha256": "adabb84c8a0c831e2c7c090bcf424732379e4c30badcbcc3d87f9dc4f0b0e6a6"
    },
    {
      "artifact_name": "deterministic_verification",
      "filename": "deterministic_verification.json",
      "sha256": "137ccc0df8ae4ff4defb544800839b0fc549ac6e211728e0f6fb9cc5e0bbcd89"
    },
    {
      "artifact_name": "arbiter_verification",
      "filename": "arbiter_verification.json",
      "sha256": "418dce31b631cffb3b7b60089aae6cc6e0b3051378054096624ac1ec1762ea9f"
    },
    {
      "artifact_name": "final_verification",
      "filename": "final_verification.json",
      "sha256": "06feb974ef55b6f813af8141ab5117791417fefeddfbf6b56bd6c0e5bdc99d13"
    }
  ],
  "bundle_hash": "365b944fe6151632cfeef211099f3f9fc775b6fb3224c84d932d9ae49f024fbb"
}
