{
  "schema_version": "v1.0",
  "benchmark_id": "invisible-tea-party",
  "scenario_id": "tea_001_ontology_spill",
  "lineage_id": "d36f70ba-2c9d-4bb6-9b9d-2a9cd4c86bdb",
  "rule_profile_version": "v1_provisional",
  "created_at": "2026-04-07T16:18:01.437Z",
  "arbiter_provider": "openai",
  "arbiter_model_id": "gpt-5.4",
  "capability_mode": "external_only",
  "core_final_score": 0.5878476190476191,
  "artifact_files": [
    {
      "artifact_name": "pass1_reasoning_state",
      "filename": "pass1.reasoning_state.json",
      "sha256": "cc46dd349b359a504caf8e74c15151ef07c0aefa4057451d34631c96340e163e"
    },
    {
      "artifact_name": "pass2_reasoning_state",
      "filename": "pass2.reasoning_state.json",
      "sha256": "7cbfd8f33acfbd95e91c600efda0341f388242995a9b5dc4f6666dfbe9d5c511"
    },
    {
      "artifact_name": "pass3_reasoning_state",
      "filename": "pass3.reasoning_state.json",
      "sha256": "ed3cb5fe377b6b2562dbadf2da5f4529c19aef967daed389d3101ed6bbdbcb38"
    },
    {
      "artifact_name": "deterministic_verification",
      "filename": "deterministic_verification.json",
      "sha256": "53686cea694019362696674faa5f187ddb0a58f1de063731a9ef44d2883caa6f"
    },
    {
      "artifact_name": "arbiter_verification",
      "filename": "arbiter_verification.json",
      "sha256": "a5f5642faca6bad4e336619cc5646724727ca1cd5ca42b4fb2ea7a15ac0a7ab5"
    },
    {
      "artifact_name": "final_verification",
      "filename": "final_verification.json",
      "sha256": "92a694a9e089f147358376f99f1df5ae03d70ed3a9fd08a10e342161efbc7c6e"
    }
  ],
  "bundle_hash": "94787c9c435b53b3f5cdc266204fae7586e8710209febbfee7581abaec796ae9"
}
