{
  "schema_version": "v1.0",
  "benchmark_id": "invisible-tea-party",
  "scenario_id": "tea_005_recursive_role",
  "lineage_id": "1d5e94b5-5a09-4a11-8285-4fd8a9f9bbab",
  "rule_profile_version": "v1_provisional",
  "created_at": "2026-04-07T16:29:52.420Z",
  "arbiter_provider": "openai",
  "arbiter_model_id": "gpt-5.4",
  "capability_mode": "external_only",
  "core_final_score": 0.49441904761904765,
  "artifact_files": [
    {
      "artifact_name": "pass1_reasoning_state",
      "filename": "pass1.reasoning_state.json",
      "sha256": "76dfe4af911418b4df90a93b53b5f4001b26d7feff1f251905298519c56fd1b8"
    },
    {
      "artifact_name": "pass2_reasoning_state",
      "filename": "pass2.reasoning_state.json",
      "sha256": "2a13f81b32dd99aca050298e67d6581062377ddf8e188e8343e159f716dbb6ff"
    },
    {
      "artifact_name": "pass3_reasoning_state",
      "filename": "pass3.reasoning_state.json",
      "sha256": "2e980be2dffa5db5db22055958fc22b83e3a9d14f09dec0f3fadaf136c4006c9"
    },
    {
      "artifact_name": "deterministic_verification",
      "filename": "deterministic_verification.json",
      "sha256": "439386f08719075742391234886a8d25ebbe744158b4c3ace57699aed2c5fbbe"
    },
    {
      "artifact_name": "arbiter_verification",
      "filename": "arbiter_verification.json",
      "sha256": "2deb101789b01a97cf9113bab834b59968c1f7e322bb66ce1ec5e15f781c82ac"
    },
    {
      "artifact_name": "final_verification",
      "filename": "final_verification.json",
      "sha256": "20cdc068a48753cb030436e5cc4e0ca7810ce634d28479edd5e9792fddff828e"
    }
  ],
  "bundle_hash": "fefe9f418ac09a8a4255691bb33ceea47ea0ecfc57d248a53e2fa9ecd4588800"
}
